{"metric_version":"insight.metrics.v2","time_window":{"kind":"rolling","duration":"24h","start":"2026-08-30T12:10:46.522656Z","end":"2026-08-31T12:10:46.522656Z"},"as_of":"2026-08-31T12:10:46.522656Z","health":{"status":"healthy","reason_codes":[],"evidence":[]},"meta":{"metric_version":"insight.metrics.v2","sample_count":0,"coverage":1,"freshness":{"state":"fresh","age_ms":6317,"threshold_ms":120000},"unknown_count":0,"known":true},"project_id":"project-ffb1c198","evolution":{"plans":1,"evolved_plans":0,"evolution_rate":0,"generation_count":0,"rework_count":0,"rework_ratio":null,"recovery_attempts":0,"recovery_successes":0,"recovery_effectiveness":null,"max_loop_depth":0,"stale_orphan_residue":0,"anomaly_drilldowns":{"rework":{"anomaly_kind":"rework","generation_parent":"non_empty","project_id":"project-ffb1c198","reason_in":["review_reject","execution_failure"]},"recovery":{"anomaly_kind":"recovery","generation_parent":"non_empty","project_id":"project-ffb1c198","reason_in":["blocked","review_reject","execution_failure"]},"loop_depth":{"anomaly_kind":"loop_depth","generation_parent":"non_empty","metric":"max_loop_depth","project_id":"project-ffb1c198"},"residue":{"anomaly_kind":"residue","generation_parent":"non_empty","project_id":"project-ffb1c198","task_status_in":["open","assigned","running","blocked","pool"]}}}}
