{"metric_version":"insight.metrics.v2","time_window":{"kind":"rolling","duration":"24h","start":"2026-08-30T12:10:46.505394Z","end":"2026-08-31T12:10:46.505394Z"},"as_of":"2026-08-31T12:10:46.505394Z","health":{"status":"unknown","reason_codes":["unknown_source_state"],"evidence":[]},"meta":{"metric_version":"insight.metrics.v2","sample_count":2,"coverage":1,"freshness":{"state":"fresh","age_ms":6300,"threshold_ms":120000},"unknown_count":1,"known":true},"project_id":"project-ffb1c198","funnel":{"issues":{"value":0,"meta":{"metric_version":"insight.metrics.v2","sample_count":0,"coverage":1,"freshness":{"state":"fresh","age_ms":6300,"threshold_ms":120000},"unknown_count":0,"known":true}},"tasks":{"value":1,"meta":{"metric_version":"insight.metrics.v2","sample_count":1,"coverage":1,"freshness":{"state":"fresh","age_ms":6300,"threshold_ms":120000},"unknown_count":0,"known":true}},"plans":{"value":1,"meta":{"metric_version":"insight.metrics.v2","sample_count":1,"coverage":1,"freshness":{"state":"fresh","age_ms":6300,"threshold_ms":120000},"unknown_count":0,"known":true}},"done":{"value":0,"meta":{"metric_version":"insight.metrics.v2","sample_count":0,"coverage":1,"freshness":{"state":"fresh","age_ms":6300,"threshold_ms":120000},"unknown_count":0,"known":true}},"breaks":[{"kind":"delivery_sha_lineage_mismatch","count":{"value":0,"meta":{"metric_version":"insight.metrics.v2","sample_count":0,"coverage":1,"freshness":{"state":"fresh","age_ms":6300,"threshold_ms":120000},"unknown_count":0,"known":true}},"drilldown":{"break_kind":"delivery_sha_lineage_mismatch","project_id":"project-ffb1c198"}},{"kind":"done_plan_non_terminal_task","count":{"value":0,"meta":{"metric_version":"insight.metrics.v2","sample_count":0,"coverage":1,"freshness":{"state":"fresh","age_ms":6300,"threshold_ms":120000},"unknown_count":0,"known":true}},"drilldown":{"break_kind":"done_plan_non_terminal_task","project_id":"project-ffb1c198"}},{"kind":"done_plan_open_issue","count":{"value":0,"meta":{"metric_version":"insight.metrics.v2","sample_count":0,"coverage":1,"freshness":{"state":"fresh","age_ms":6300,"threshold_ms":120000},"unknown_count":0,"known":true}},"drilldown":{"break_kind":"done_plan_open_issue","project_id":"project-ffb1c198"}},{"kind":"evolution_old_generation_residue","count":{"value":0,"meta":{"metric_version":"insight.metrics.v2","sample_count":0,"coverage":1,"freshness":{"state":"fresh","age_ms":6300,"threshold_ms":120000},"unknown_count":0,"known":true}},"drilldown":{"break_kind":"evolution_old_generation_residue","project_id":"project-ffb1c198"}},{"kind":"issue_without_task","count":{"value":0,"meta":{"metric_version":"insight.metrics.v2","sample_count":0,"coverage":1,"freshness":{"state":"fresh","age_ms":6300,"threshold_ms":120000},"unknown_count":0,"known":true}},"drilldown":{"break_kind":"issue_without_task","project_id":"project-ffb1c198"}},{"kind":"task_multiple_containers","count":{"value":0,"meta":{"metric_version":"insight.metrics.v2","sample_count":0,"coverage":1,"freshness":{"state":"fresh","age_ms":6300,"threshold_ms":120000},"unknown_count":0,"known":true}},"drilldown":{"break_kind":"task_multiple_containers","project_id":"project-ffb1c198"}},{"kind":"task_without_plan","count":{"value":1,"meta":{"metric_version":"insight.metrics.v2","sample_count":1,"coverage":1,"freshness":{"state":"fresh","age_ms":6300,"threshold_ms":120000},"unknown_count":0,"known":true}},"drilldown":{"break_kind":"task_without_plan","project_id":"project-ffb1c198"}}]}}
